{
  "name": "TAOP adversarial agent-reputation pattern dataset",
  "version": "0.1.0",
  "license": "CC-BY-4.0",
  "description": "Documented adversarial patterns against agent-reputation and adjacent trust systems, grouped by the three benchmark attack classes: sybil_farming, slow_burn_harvest, collusive_ring. Entries describe the pattern, the on-chain signals a defender can observe, and the mitigations that apply. Sources are cited conservatively; entries marked confidence=medium/low are industry-reported or academic analogs rather than measured incidents in agent-reputation systems.",
  "attackClasses": {
    "sybil_farming": "Many cheap identities manufacture reputation without tasks of value.",
    "slow_burn_harvest": "A single identity accumulates reputation slowly, then extracts once.",
    "collusive_ring": "A group of identities mutually inflate each other's reputation."
  },
  "patterns": [
    {
      "id": "sybil-001",
      "title": "Classic Sybil identity multiplication",
      "attackClass": "sybil_farming",
      "description": "An adversary creates many identities that are not tied to distinct real-world principals and uses them to gain influence in a reputation or voting system.",
      "onChainSignals": ["many accounts funded from one source", "identical funding amounts and timing", "low per-account activity outside the reputation program"],
      "realWorldEvidence": "The foundational formal analysis of Sybil attacks establishes that identity creation is cheap without a central authority or a costly identity primitive.",
      "sources": [{ "title": "The Sybil Attack", "authors": "John R. Douceur", "venue": "IPTPS", "year": 2002 }],
      "applicableMechanisms": ["self_attestation", "peer_ratings", "stake_gated"],
      "mitigations": ["charge a non-recoverable identity cost", "require bonded capital per identity", "weight actions by counterparty diversity"],
      "severity": "high",
      "confidence": "high"
    },
    {
      "id": "sybil-002",
      "title": "Sybil farming of self-attested completions",
      "attackClass": "sybil_farming",
      "description": "Fresh identities self-attest large numbers of completions with no verifier in the loop, converting transaction fees into apparent reputation.",
      "onChainSignals": ["bursts of attestations from new accounts", "no challenger activity", "zero counterparty accounts touched"],
      "realWorldEvidence": "Early empirical work on permissionless agent-reputation registries reports weak grounding and substantial Sybil behaviour in feedback data.",
      "sources": [{ "title": "Can Trustless Agents Be Trusted?", "authors": "Xiong et al.", "venue": "arXiv", "year": 2026, "url": "https://arxiv.org/abs/2606.26028" }],
      "applicableMechanisms": ["self_attestation"],
      "mitigations": ["bonded challenges with watchers", "interaction-grounded attestations", "cap score per counterparty"],
      "severity": "high",
      "confidence": "high"
    },
    {
      "id": "sybil-003",
      "title": "Airdrop farming with disposable wallets",
      "attackClass": "sybil_farming",
      "description": "Farmers split activity across hundreds of wallets to satisfy per-identity eligibility thresholds, then consolidate rewards.",
      "onChainSignals": ["wallet clusters with synchronized transactions", "funding graphs converging on a few hubs", "activity limited to eligibility actions"],
      "realWorldEvidence": "Widely documented in incentive-program analyses across ecosystems; identity-per-wallet assumptions repeatedly failed.",
      "sources": [{ "title": "Industry analyses of token distribution farming", "venue": "Ecosystem reports", "year": 2023 }],
      "applicableMechanisms": ["self_attestation", "stake_gated"],
      "mitigations": ["sybil-resistant eligibility (proof of personhood, staking with lockups)", "cluster detection on funding graphs"],
      "severity": "high",
      "confidence": "medium"
    },
    {
      "id": "sybil-004",
      "title": "Social-graph Sybil defenses fail on sparse or adversarial graphs",
      "attackClass": "sybil_farming",
      "description": "Defenses that rely on the honest region of a social graph being fast-mixing can be defeated when attackers establish believable edges or when the graph is sparse.",
      "onChainSignals": ["new-but-connected accounts", "small-world clusters around the target", "edges with no economic weight"],
      "realWorldEvidence": "Analyses of social-network Sybil defenses show limited guarantees against adversaries who can create or buy edges.",
      "sources": [
        { "title": "SybilGuard: Defending Against Sybil Attacks via Social Networks", "authors": "Yu, Kaminsky, Gibbons, Flaxman", "venue": "SIGCOMM", "year": 2006 },
        { "title": "An Analysis of Social Network-Based Sybil Defenses", "authors": "Viswanath, Post, Gummadi, Mislove", "venue": "SIGCOMM", "year": 2010 }
      ],
      "applicableMechanisms": ["peer_ratings"],
      "mitigations": ["price the edges", "require economic interaction history", "combine graph signals with stake"],
      "severity": "medium",
      "confidence": "high"
    },
    {
      "id": "sybil-005",
      "title": "Sybil-resilient voting via per-user tickets (SumUp)",
      "attackClass": "sybil_farming",
      "description": "Content-voting systems resist Sybil votes by giving each user a vote credit per item that is weighted by the voter's global influence; bought votes collapse toward zero weight.",
      "onChainSignals": ["vote concentration", "same-batch voting", "voter overlap between target items"],
      "realWorldEvidence": "SumUp demonstrates practical Sybil resilience without identity verification by tuning per-user influence.",
      "sources": [{ "title": "Sybil-Resilient Online Content Voting", "authors": "Tran, Min, Li, Subramanian", "venue": "NSDI", "year": 2009 }],
      "applicableMechanisms": ["peer_ratings"],
      "mitigations": ["influence-weighted votes", "per-counterparty contribution caps"],
      "severity": "medium",
      "confidence": "high"
    },
    {
      "id": "sybil-006",
      "title": "Identity cost inversion under subsidized fees",
      "attackClass": "sybil_farming",
      "description": "When transaction fees are subsidized or refunded, identity creation and activity become free, collapsing any fee-based Sybil resistance.",
      "onChainSignals": ["fee payer accounts distinct from actors", "sponsored transactions at scale", "rent refunds recycled into new accounts"],
      "realWorldEvidence": "Observed in fee-subsidy programs where farming cost fell to zero; protocol subsidies are routinely farmed.",
      "sources": [{ "title": "Program-subsidy farming reports", "venue": "Ecosystem reports", "year": 2024 }],
      "applicableMechanisms": ["self_attestation", "naive_count"],
      "mitigations": ["charge identity-storage rent that is not refundable to the actor", "bond capital that is slashable, not refundable"],
      "severity": "high",
      "confidence": "medium"
    },
    {
      "id": "sybil-007",
      "title": "Sockpuppet accounts in moderated platforms",
      "attackClass": "sybil_farming",
      "description": "Operators of multiple accounts use them to amplify content or evade sanctions while appearing independent.",
      "onChainSignals": ["shared infrastructure fingerprints", "correlated activity windows", "mutual amplification without economic exchange"],
      "realWorldEvidence": "Public arbitration cases and platform integrity reports document long-running sockpuppet investigations.",
      "sources": [{ "title": "Platform integrity and arbitration case records", "venue": "Platform governance records", "year": 2022 }],
      "applicableMechanisms": ["peer_ratings"],
      "mitigations": ["behavioral correlation analysis", "per-device or per-principal caps", "delayed score vesting"],
      "severity": "medium",
      "confidence": "high"
    },
    {
      "id": "sybil-008",
      "title": "Cross-account score laundering",
      "attackClass": "sybil_farming",
      "description": "High-reputation accounts are retired and their reputation, capabilities, or credentials are transferred to fresh accounts, defeating per-identity reset penalties.",
      "onChainSignals": ["capability transfers to new owners", "sudden inactivity followed by mirror activity", "shared metadata URIs across identities"],
      "realWorldEvidence": "Analogous to aged-account and credential-resale markets documented across platforms.",
      "sources": [{ "title": "Aged-account and credential resale reporting", "venue": "Platform trust-and-safety reporting", "year": 2023 }],
      "applicableMechanisms": ["self_attestation", "peer_ratings"],
      "mitigations": ["non-transferable capability records", "reputation attached to work products with provenance"],
      "severity": "medium",
      "confidence": "medium"
    },
    {
      "id": "sybil-009",
      "title": "Sybil amplification of challenge outcomes",
      "attackClass": "sybil_farming",
      "description": "An attacker uses many identities to overwhelm the resolver with frivolous challenges or to coordinate mass-false disputes against a competitor.",
      "onChainSignals": ["many challenges from related accounts", "challenges with empty or duplicated evidence URIs", "challenger funding clusters"],
      "realWorldEvidence": "Griefing-by-volume is a standard denial-of-service pattern for adjudicated systems.",
      "sources": [{ "title": "Denial of service via adjudication volume", "venue": "Security folklore and incident reports", "year": 2021 }],
      "applicableMechanisms": ["self_attestation"],
      "mitigations": ["bonded challenges that are forfeited when rejected", "per-challenger rate limits", "evidence-hash deduplication"],
      "severity": "medium",
      "confidence": "medium"
    },
    {
      "id": "sybil-010",
      "title": "Stake rental (capital as a service)",
      "attackClass": "sybil_farming",